{"artifacts":{"keyframe_paths":["work/orders_pilot/keyframe_0.5s.png","work/orders_pilot/keyframe_3.0s.png","work/orders_pilot/keyframe_5.3s.png","work/orders_pilot/keyframe_7s5.png","work/orders_pilot/keyframe_11s5.png"],"source_paths":["scripts/primitives/orderflow.py","scripts/primitives/__init__.py","work/orders_pilot/scene.json"],"video_path":"work/orders_pilot/orders_silent.mp4"},"attempt":1,"checks":[{"detail":"validate.py: OK, 1 scene, 960x540, duration 13.0s; orderflow registered as 17th primitive","name":"scene_schema_validate","result":"pass"},{"detail":"tests/test_engine.py: 5 pass, 3 pre-existing failures (examples/*.json non-scene files); tests/test_v21.py: 7 pass (1 skipped). Pre-existing failures confirmed on clean tree via git stash.","name":"existing_tests","result":"pass"},{"detail":"render.py: 312 frames rendered in 4.4s; ffprobe confirms 960x540, 24fps, 13.0s, valid MP4","name":"render_mp4","result":"pass"},{"detail":"5 keyframes extracted from rendered MP4 via ffmpeg at t=0.5/3.0/5.3/7.5/11.5s; visually inspected: cards A/B keep identity, decision node shows both branches, final state shows A shipped / B waiting","name":"keyframe_inspection","result":"pass"},{"detail":"workflow/check_handoff.py --spec examples/workflow_orders_spec.json: PASS","name":"spec_handoff_gate","result":"pass"}],"deviations":[],"implementation_commit":"aa880eae82c0c7f28dcbbebc62b305a8fa311cb6","notes":"无声原型(stage B)。实现方式:自定义原语 orderflow(确定性时间函数,分段eased插值),无瞬移。A/B在库存检查节点处上下错开34px以避免完全重叠。未做配音,未声明视觉验收通过,待独立QA。","project_id":"orders_two_routes","schema_version":"1.0","spec_id":"orders_shot_001","spec_revision":1,"spec_sha256":"567c17cc7290292375c42dc98e7dbf6253638148c69824426fae02625f49624c","stage":"B","status":"ready_for_qa"}